{"iteration":0,"runId":"20260806T051830Z-8cnu","parent":null,"verdict":"keep","score":0.68995,"pass":true,"metrics":{"mean_best":0.68995,"min_best":0.622327,"train_mean_best":0.691511,"generalisation_gap":0.001561,"invalid_selections":0,"strategy_errors":0,"n_landscapes":40},"description":"baseline — the scaffold as written, before any agent edits","rationale":"Baseline established. Every later iteration is measured against this.","snapshot":"runs/20260806T051830Z-8cnu/snapshots/0","durationMs":232.774042,"createdAt":"2026-08-06T05:18:30.909Z"}
{"iteration":1,"runId":"20260806T051830Z-8cnu","parent":0,"verdict":"keep","score":0.702461,"pass":true,"metrics":{"mean_best":0.702461,"min_best":0.627715,"train_mean_best":0.700244,"generalisation_gap":-0.002217,"invalid_selections":0,"strategy_errors":0,"n_landscapes":40},"description":"Replaced champion-plus-25%-recency selection with a deterministic acquisition rule that scores each archive entry by closed-form Gaussian expected improvement over the current best (mean/variance est…","rationale":"mean_best = 0.702461 (beats 0.68995; higher is better).","snapshot":"runs/20260806T051830Z-8cnu/snapshots/1","durationMs":617219.408875,"createdAt":"2026-08-06T05:28:48.286Z","patch":"runs/20260806T051830Z-8cnu/steps/iteration-0001.patch","diffStat":{"filesChanged":1,"insertions":127,"deletions":33},"files":["solution/strategy.py"]}
{"iteration":2,"runId":"20260806T051830Z-8cnu","parent":1,"verdict":"keep","score":0.708138,"pass":true,"metrics":{"mean_best":0.708138,"min_best":0.614263,"train_mean_best":0.69747,"generalisation_gap":-0.010669,"invalid_selections":0,"strategy_errors":0,"n_landscapes":40},"description":"Replaced the geometric per-index novelty term `((N-1)/N)^children` with an exact per-genome one, `(20 - |mapped neighbours|)/20`, where genome identity and hypercube edges are inferred from exact sco…","rationale":"mean_best = 0.708138 (beats 0.702461; higher is better).","snapshot":"runs/20260806T051830Z-8cnu/snapshots/2","durationMs":440555.3916669999,"createdAt":"2026-08-06T05:36:08.850Z","patch":"runs/20260806T051830Z-8cnu/steps/iteration-0002.patch","diffStat":{"filesChanged":1,"insertions":59,"deletions":21},"files":["solution/strategy.py"]}
{"iteration":3,"runId":"20260806T051830Z-8cnu","parent":2,"verdict":"discard","score":0.707149,"pass":true,"metrics":{"mean_best":0.707149,"min_best":0.628065,"train_mean_best":0.699099,"generalisation_gap":-0.00805,"invalid_selections":0,"strategy_errors":0,"n_landscapes":40},"description":"Replaced the online-fitted additive delta model (`E[child] = parent + pooled mu`) in the EI acquisition with the exact conditional mean derived from the NK generator, `E[child | parent=f] = 0.75f + 0…","rationale":"mean_best = 0.707149 does not beat champion 0.708138 (higher is better).","snapshot":null,"durationMs":317255.173125,"createdAt":"2026-08-06T05:41:26.071Z","patch":"runs/20260806T051830Z-8cnu/steps/iteration-0003.patch","diffStat":{"filesChanged":1,"insertions":57,"deletions":25},"files":["solution/strategy.py"]}
{"iteration":4,"runId":"20260806T051830Z-8cnu","parent":2,"verdict":"discard","score":0.69914,"pass":true,"metrics":{"mean_best":0.69914,"min_best":0.627715,"train_mean_best":0.697173,"generalisation_gap":-0.001967,"invalid_selections":0,"strategy_errors":0,"n_landscapes":40},"description":"Multiplied the acquisition's per-genome novelty factor `untried/20` by a Beta-Binomial survival factor `20/(20 + mapped)` — the posterior probability that an unmapped neighbour still beats the incumb…","rationale":"mean_best = 0.69914 does not beat champion 0.708138 (higher is better).","snapshot":null,"durationMs":743774.387541,"createdAt":"2026-08-06T05:53:49.848Z","patch":"runs/20260806T051830Z-8cnu/steps/iteration-0004.patch","diffStat":{"filesChanged":1,"insertions":34,"deletions":8},"files":["solution/strategy.py"]}
{"iteration":5,"runId":"20260806T051830Z-8cnu","parent":1,"verdict":"keep","score":0.71198,"pass":true,"metrics":{"mean_best":0.71198,"min_best":0.614263,"train_mean_best":0.699748,"generalisation_gap":-0.012232,"invalid_selections":0,"strategy_errors":0,"n_landscapes":40},"description":"Replaced the Gaussian delta model in the EI acquisition with a variance-matched Student-t (3 dof, closed-form elementary pdf/cdf), leaving mu and sigma unchanged so only the tail shape moves — polyno…","rationale":"mean_best = 0.71198 (beats 0.702461; higher is better).","snapshot":"runs/20260806T051830Z-8cnu/snapshots/5","durationMs":796062.1665420001,"createdAt":"2026-08-06T06:07:05.912Z","patch":"runs/20260806T051830Z-8cnu/steps/iteration-0005.patch","diffStat":{"filesChanged":1,"insertions":110,"deletions":35},"files":["solution/strategy.py"]}
{"iteration":6,"runId":"20260806T051830Z-8cnu","parent":2,"verdict":"keep","score":0.713798,"pass":true,"metrics":{"mean_best":0.713798,"min_best":0.627715,"train_mean_best":0.694911,"generalisation_gap":-0.018887,"invalid_selections":0,"strategy_errors":0,"n_landscapes":40},"description":"Replaced the acquisition's single-draw novelty factor `untried/20` with a budget-aware count of useful draws — `untried × (1 − (19/20)^min(untried, remaining))` distinct unmapped neighbours reachable…","rationale":"mean_best = 0.713798 (beats 0.708138; higher is better).","snapshot":"runs/20260806T051830Z-8cnu/snapshots/6","durationMs":641532.542833,"createdAt":"2026-08-06T06:17:47.637Z","patch":"runs/20260806T051830Z-8cnu/steps/iteration-0006.patch","diffStat":{"filesChanged":1,"insertions":70,"deletions":14},"files":["solution/strategy.py"]}
